eventdate,title,image,link,credit2013-06-20,Ice Cream Soda Day,milkshake.svg,http://holidayinsights.com/moreholidays/June/icecreamsodaday.htm,Milkshake designed by Diego Naive from The Noun Project2013-06-21,Go Skateboarding Day,skateboard.svg,http://www.goskateboardingday.org/,Skateboard from The Noun Project2013-06-22,Great American Backyard Campout,campfire.svg,http://www.nwf.org/Great-American-Backyard-Campout.aspx,Campfire designed by Megan Sheehan from The Noun Project2013-06-23,UN Public Service Day,un.svg,http://www.un.org/en/events/publicserviceday/,Wikipedia2013-06-24,International Fairy Day,wand.svg,http://www.punchbowl.com/holidays/2013/6/24/international-fairy-day,Magic Wand designed by Anna Sher from The Noun Project2013-06-25,National Catfish Day,catfish.svg,http://holidayinsights.com/moreholidays/June/catfishday.htm,Catfish designed by Mallory Hawes from The Noun Project2013-06-26,National Chocolate Pudding Day,bowl.svg,http://www.punchbowl.com/holidays/2013/6/26/national-chocolate-pudding-day,Bowl designed by Anna Evans from The Noun Project2013-06-27,Sun Glasses Day,sunglasses.svg,http://holidayinsights.com/moreholidays/June/sunglassesday.htm,Sunglasses designed by Okan Benn from The Noun Project2013-06-28,INTERNATIONAL CAPS LOCK DAY!,keyboard.svg,http://www.punchbowl.com/holidays/2013/6/28/international-caps-lock-day,Keyboard designed by Paul te Kortschot from The Noun Project2013-06-29,Camera Day,camera.svg,http://holidayinsights.com/moreholidays/June/cameraday.htm,Camera designed by Stanislav Levin from The Noun Project2013-06-30,Meteor Day,comet.svg,http://www.punchbowl.com/holidays/2013/6/30/meteor-day,Comet designed by Gilad Fried from The Noun Project2013-07-01,International Joke Day,disguise.svg,http://holidayinsights.com/moreholidays/July/intljokeday.htm,Disguise designed by Ian Kirkland from The Noun Project2013-07-02,World UFO Day,ufo.svg,http://www.punchbowl.com/holidays/2013/7/2/world-ufo-day,UFO designed by Kari Gaynor from The Noun Project2013-07-03,Eat Beans Day,beans.svg,http://www.punchbowl.com/holidays/2013/7/3/eat-beans-day,Beans designed by Doug Cavendish from The Noun Project2013-07-04,National Country Music Day,cowboyboot.svg,http://holidayinsights.com/moreholidays/July/countrymusicday.htm,Cowboy Boot designed by Roy Milton from The Noun Project2013-07-05,Work-a-holics Day,work.svg,http://www.punchbowl.com/holidays/2013/7/5/workaholics-day,Worker from The Noun Project2013-07-06,National Fried Chicken Day,chicken.svg,http://holidayinsights.com/moreholidays/July/friedchickenday.htm,Chicken from The Noun Project2013-07-07,Chocolate Day,chocolate.svg,http://www.punchbowl.com/holidays/2013/7/7/chocolate-day,Chocolate designed by Yo Szczepanska from The Noun Project2013-07-08,Video Game Day,game.svg,http://www.punchbowl.com/holidays/2013/7/8/video-game-day,Video Game from The Noun Project2013-07-09,National Sugar Cookie Day,cookie.svg,http://holidayinsights.com/moreholidays/July/sugarcookieday.htm,Cookie designed by Elves Sousa from The Noun Project2013-07-10,Teddy Bear Picnic Day,teddy.svg,http://holidayinsights.com/moreholidays/July/teddybearpicnic.htm,Teddy Bear from The Noun Project2013-07-11,World Population Day,people2.svg,http://www.punchbowl.com/holidays/2013/7/11/world-population-day,People designed by Roman J. Sokolov from The Noun Project2013-07-12,National Pecan Pie Day,pie.svg,http://holidayinsights.com/moreholidays/July/pecanpieday.htm,Pie designed by Connie Shu from The Noun Project2013-07-13,National French Fries Day,fries.svg,http://www.punchbowl.com/holidays/2013/7/13/national-french-fries-day,French Fries designed by Lucas Saw from The Noun Project2013-07-14,National Nude Day,nude.svg,http://holidayinsights.com/moreholidays/July/nationalnudeday.htm,Nude Beach designed by Megan Gross from The Noun Project2013-07-15,Cow Appreciation Day,cow.svg,http://holidayinsights.com/moreholidays/July/cowappreciationday.htm,Cow from The Noun Project2013-07-17,Yellow Pig Day,pig.svg,http://www.punchbowl.com/holidays/2013/7/17/yellow-pig-day,Pig from The Noun Project2013-07-18,National Caviar Day,ball.svg,http://holidayinsights.com/moreholidays/July/caviarday.htm,Ball designed by Alex Fuller from The Noun Project2013-07-19,National Raspberry Cake Day,cake.svg,http://holidayinsights.com/moreholidays/July/raspberrycakeday.htm,Cake  from The Noun Project2013-07-20,National Lollipop Day,lollipop.svg,http://www.punchbowl.com/holidays/2013/7/20/national-lollipop-day,Lollipop designed by Paulo S‡ Ferreira from The Noun Project2013-07-21,National Junk Food Day,candy.svg,http://www.punchbowl.com/holidays/2013/7/21/national-junk-food-day,Candy from The Noun Project2013-07-22,Hammock Day,hammock.svg,http://holidayinsights.com/other/hammock.htm,Hammock designed by Adam  Mullin from The Noun Project2013-07-23,National Hot Dog Day,hotdog.svg,http://holidayinsights.com/moreholidays/July/hotdogday.htm,Hot Dog designed by Trevor Tarczynski from The Noun Project2013-07-24,Cousins Day,people.svg,http://www.punchbowl.com/holidays/2013/7/24/cousins-day,People designed by richard pasqua from The Noun Project2013-07-25,Culinarians Day,chef.svg,http://holidayinsights.com/moreholidays/July/culinariansday.htm,Chef from The Noun Project2013-07-26,All or Nothing Day,yingyang.svg,http://www.punchbowl.com/holidays/2013/7/26/all-or-nothing-day,Ying Yang designed by Unknown from The Noun Project2013-07-27,National Day of The Cowboy,cowboyboot.svg,http://www.punchbowl.com/holidays/2013/7/27/national-day-of-the-cowboy,Cowboy Boot designed by Roy Milton from The Noun Project2013-07-28,National Milk Chocolate Day,chocolate.svg,http://holidayinsights.com/moreholidays/July/milkchocolateday.htm,Chocolate designed by Yo Szczepanska from The Noun Project2013-07-29,National Lasagna Day,dish.svg,http://www.punchbowl.com/holidays/2013/7/29/national-lasagna-day,Serving Dish designed by Benjamin Orlovski from The Noun Project2013-07-30,National Cheesecake Day,cake.svg,http://holidayinsights.com/moreholidays/July/cheesecakeday.htm,Cake  from The Noun Project2013-07-31,Jump for Jelly Beans Day,jellybeans.svg,http://www.punchbowl.com/holidays/2013/7/31/jump-for-jelly-beans-day,Beans designed by giulia bianchi from The Noun Project2013-08-01,National Girlfriends Day,woman.svg,http://www.punchbowl.com/holidays/2013/8/1/national-girlfriends-day,Woman designed by Monika Ciapala from The Noun Project2013-08-02,National Ice Cream Sandwich Day,icecream1.svg,http://holidayinsights.com/moreholidays/August/icecreamsandwich.htm,Ice Cream Cone designed by Jason Grube from The Noun Project2013-08-03,National Watermelon Day,watermelon.svg,http://www.punchbowl.com/holidays/2013/8/3/national-watermelon-day,Watermelon  from The Noun Project2013-08-04,Friendship Day,friends.svg,http://holidayinsights.com/moreholidays/August/friendshipday.htm,Friends designed by Rob Schill from The Noun Project2013-08-05,International Beer Day,beer.svg,http://www.internationalbeerday.com/,Beer designed by Benoit Champy from The Noun Project2013-08-06,Wiggle Your Toes Day,footprint.svg,http://holidayinsights.com/moreholidays/August/wiggleyourtoes.htm,Footprint from The Noun Project2013-08-07,National Lighthouse Day,lighthouse.svg,http://www.punchbowl.com/holidays/2013/8/7/national-lighthouse-day,Lighthouse from The Noun Project2013-08-08,National Zucchini Day,cucumber.svg,http://www.punchbowl.com/holidays/2013/8/8/national-zucchini-day,Cucumber designed by Ashwini Sukhdeve from The Noun Project2013-08-09,Book Lover's Day,book.svg,http://holidayinsights.com/moreholidays/August/bookloversday.htm,Book designed by Nathan Thomson from The Noun Project2013-08-10,National S'mores Day,smore.svg,http://www.punchbowl.com/holidays/2013/8/10/national-smores-day,Smore from The Noun Project2013-08-11,Son and Daughter Day,children.svg,http://holidayinsights.com/moreholidays/August/sondaughterday.htm,Children designed by Gilad Fried from The Noun Project2013-08-12,International Youth Day,child.svg,http://www.un.org/en/events/youthday/,Child designed by Javier Cabezas from The Noun Project2013-08-13,Left Hander's Day,lefthand.svg,http://www.punchbowl.com/holidays/2013/8/13/left-handers-day,Hand designed by Maico Amorim from The Noun Project2013-08-14,National Creamsicle Day,creamsicle.svg,http://holidayinsights.com/moreholidays/August/creamsickleday.htm,Ice Cream Bar designed by Liran Lin from The Noun Project2013-08-15,Relaxation Day,spa.svg,http://www.punchbowl.com/holidays/2013/8/15/national-relaxation-day,Spa designed by Amelia Wattenberger from The Noun Project2013-08-16,National Tell a Joke Day,disguise.svg,http://holidayinsights.com/moreholidays/August/tellajokeday.htm,Disguise designed by Ian Kirkland from The Noun Project2013-08-17,National Thriftshop Day,store.svg,http://holidayinsights.com/moreholidays/August/thriftshopday.htm,Store designed by Edward Boatman from The Noun Project2013-08-18,National Soft Ice Cream Day,softicecream.svg,http://www.punchbowl.com/holidays/2013/8/18/national-soft-ice-cream-day,Ice Cream Cone designed by Tatiana Marcussian from The Noun Project2013-08-19,Aviation Day,airplane.svg,http://holidayinsights.com/moreholidays/August/aviationday.htm,Airplane designed by Gilad Fried from The Noun Project2013-08-20,National Lemonade Day,lemonade.svg,http://www.punchbowl.com/holidays/2013/8/20/national-lemonade-day,Lemonade designed by Zachary Wall from The Noun Project2013-08-21,National Senior Citizen's Day,senior.svg,http://holidayinsights.com/moreholidays/August/seniorcitizensday.htm,Senior Citizen designed by Lemon Liu from The Noun Project2013-08-22,Be an Angel Day,angel.svg,http://www.punchbowl.com/holidays/2013/8/22/be-an-angel-day,Angel designed by Okan Benn from The Noun Project2013-08-23,National Sponge Cake Day,cake.svg,http://www.punchbowl.com/holidays/2013/8/23/national-sponge-cake-day,Cake  from The Noun Project2013-08-24,National Waffle Day,waffle.svg,http://www.punchbowl.com/holidays/2013/8/24/national-waffle-day,Waffle designed by Jacob Halton from The Noun Project2013-08-25,Kiss and Make Up Day,kiss.svg,http://holidayinsights.com/moreholidays/August/kissandmakeup.htm,Kiss designed by Luis Prado from The Noun Project2013-08-26,National Dog Day,dog.svg,http://www.punchbowl.com/holidays/2013/8/26/national-dog-day,Dog from The Noun Project2013-08-27,Global Forgiveness Day,forgive.svg,http://holidayinsights.com/moreholidays/August/forgivenessday.htm,Couple designed by baabullah hasan from The Noun Project2013-08-28,National Cherry Turnover Day,cherry.svg,http://www.punchbowl.com/holidays/2013/8/28/national-cherry-turnover-day,Cherry designed by Benjamin Orlovski from The Noun Project2013-08-29,Chop Suey Day,noodles.svg,http://www.punchbowl.com/holidays/2013/8/29/chop-suey-day,Noodles designed by Carson Reeves from The Noun Project2013-08-30,National Toasted Marshmallow Day,campfire.svg,http://www.punchbowl.com/holidays/2013/8/30/national-toasted-marshmallow-day,Campfire designed by Megan Sheehan from The Noun Project2013-08-31,Eat Outside Day,bbq.svg,http://www.punchbowl.com/holidays/2013/8/31/eat-outside-day,Barbecue designed by Joris Hoogendoorn from The Noun Project2013-09-01,Emma M. Nutt Day,phone.svg,http://en.wikipedia.org/wiki/Emma_Nutt,Telephone designed by Proletkult Graphik from The Noun Project2013-09-02,National Blueberry Popsicle Day,creamsicle.svg,http://www.punchbowl.com/holidays/2013/9/2/national-blueberry-popsicle-day,Ice Cream Bar designed by Liran Lin from The Noun Project2013-09-03,Skyscraper Day,city.svg,http://holidayinsights.com/moreholidays/September/skyscraperday.htm,City designed by R_my M_dard from The Noun Project2013-09-04,National Wildlife Day,wildlife.svg,http://www.nationalwildlifeday.com/,Animals designed by Pete Fecteau from The Noun Project2013-09-05,National Cheese Pizza Day,cheese.svg,http://www.punchbowl.com/holidays/2013/9/5/national-cheese-pizza-day,Cheese from The Noun Project2013-09-06,Read a Book Day,book.svg,http://holidayinsights.com/moreholidays/September/readabook.htm,Book designed by Nathan Thomson from The Noun Project2013-09-07,Salami Day,sausage.svg,http://www.punchbowl.com/holidays/2013/9/7/salami-day,Sausage designed by Jacob Halton from The Noun Project2013-09-08,International Literacy Day,books.svg,http://www.unesco.org/new/unesco/events/prizes-and-celebrations/celebrations/international-days/literacy-day/,Stack of Books designed by Benjamin Orlovski from The Noun Project2013-09-09,Teddy Bear Day,teddy.svg,http://holidayinsights.com/moreholidays/September/teddybearday.htm,Teddy Bear from The Noun Project2013-09-10,Swap Ideas Day,idea.svg,http://holidayinsights.com/moreholidays/September/swapideasday.htm,Idea designed by Cyrille LE FLOCH from The Noun Project2013-09-11,National Hot Cross Bun Day,bun.svg,http://www.punchbowl.com/holidays/2013/9/11/national-hot-cross-bun-day,Bun from The Noun Project2013-09-12,National Chocolate Milkshake Day,milkshake.svg,http://www.punchbowl.com/holidays/2013/9/12/national-chocolate-milkshake-day,Milkshake designed by Diego Naive from The Noun Project2013-09-13,Fortune Cookie Day,fortune.svg,http://holidayinsights.com/other/fortunecookie.htm,Hamantash Cookie designed by Mike Wirth from The Noun Project2013-09-14,Eat A Hoagie Day,hoagie.svg,http://www.punchbowl.com/holidays/2013/9/14/eat-a-hoagie-day,Sandwich designed by Yara Soliman from The Noun Project2013-09-15,Make a Hat Day,hat.svg,http://holidayinsights.com/moreholidays/September/makeahatday.htm,Hat designed by Edaimon DeJuan from The Noun Project2013-09-16,National Guacamole Day,avocado.svg,http://www.punchbowl.com/holidays/2013/9/16/national-guacamole-day,Avocado designed by Michael Rowe from The Noun Project2013-09-17,Citizenship Day,citizen.svg,http://holidayinsights.com/moreholidays/September/appledumplingday.htm,Citizen from The Noun Project2013-09-18,National Cheeseburger Day,hamburger.svg,http://www.punchbowl.com/holidays/2013/9/18/national-cheeseburger-day,Hamburger designed by Pei Wen (Winnie) Kwang from The Noun Project2013-09-19,International Talk Like A Pirate Day,pirate.svg,http://www.talklikeapirate.com/howto.html,Pirate from The Noun Project2013-09-20,National Punch Day,cocktail.svg,http://www.punchbowl.com/holidays/2013/9/20/national-punch-day,Cocktail from The Noun Project2013-09-21,Miniature Golf Day,golf.svg,http://holidayinsights.com/moreholidays/September/miniaturegolfday.htm,Golf  from The Noun Project2013-09-22,Elephant Appreciation Day,elephant.svg,http://holidayinsights.com/moreholidays/September/elephantappreciationday.htm,Elephant designed by Sean Henderson from The Noun Project2013-09-23,Checkers Day,checkers.svg,http://www.punchbowl.com/holidays/2013/9/23/checkers-day,Checkerboard designed by Benjamin Orlovski from The Noun Project2013-09-24,National Cherries Jubilee Day,cherry.svg,http://www.punchbowl.com/holidays/2013/9/24/national-cherries-jubilee-day,Cherry designed by Benjamin Orlovski from The Noun Project2013-09-25,National Comic Book Day,comics.svg,http://holidayinsights.com/moreholidays/September/comicbookday.htm,Comic Book designed by Carlo Cari–o from The Noun Project2013-09-26,Love Note Day,lovenote.svg,http://www.punchbowl.com/holidays/2013/9/26/love-note-day,Love Letter designed by Scott Lewis from The Noun Project2013-09-27,World Tourism Day,tourist.svg,http://en.wikipedia.org/wiki/World_Tourism_Day,Tourist designed by Javier Cabezas from The Noun Project2013-09-28,Drink Beer Day,beer.svg,http://www.punchbowl.com/holidays/2013/9/28/drink-beer-day,Beer designed by Benoit Champy from The Noun Project2013-09-29,National Coffee Day,coffee.svg,http://www.punchbowl.com/holidays/2013/9/29/national-coffee-day,Coffee designed by Christopher Smith from The Noun Project2013-09-30,National Mud Pack Day,spa.svg,http://holidayinsights.com/moreholidays/September/mudpackday.htm,Spa designed by Amelia Wattenberger from The Noun Project2013-10-01,World Vegetarian Day,carrot.svg,http://www.punchbowl.com/holidays/2013/10/1/world-vegetarian-day,Carrot designed by Ricardo Moreira from The Noun Project2013-10-02,Balloons Around The World Day,balloons.svg,http://www.punchbowl.com/holidays/2013/10/2/balloons-around-the-world-day,Balloon from The Noun Project2013-10-03,Techies Day,computer.svg,http://holidayinsights.com/moreholidays/October/techiesday.htm,Computer designed by Patrick Morrison from The Noun Project2013-10-04,National Taco Day,taco.svg,http://www.punchbowl.com/holidays/2013/10/4/national-taco-day,Taco designed by Pei Wen (Winnie) Kwang from The Noun Project2013-10-05,World Teacher's Day,teacher.svg,http://holidayinsights.com/moreholidays/October/worldteacherday.htm,Teacher from The Noun Project2013-10-06,Mad Hatter Day,madhat.svg,http://www.punchbowl.com/holidays/2013/10/6/mad-hatter-day,Rabbit in a Hat designed by Adam  Mullin from The Noun Project2013-10-07,World Smile Day,smile.svg,http://holidayinsights.com/moreholidays/October/worldsmileday.htm,Smile from The Noun Project2013-10-08,American Touch Tag Day,tag.svg,http://holidayinsights.com/moreholidays/October/americantagday.htm,Tag from The Noun Project2013-10-09,Curious Events Day,curious.svg,http://holidayinsights.com/moreholidays/October/curiouseventsday.htm,Curious designed by Michael Rowe from The Noun Project2013-10-10,National Cake Decorating Day,cake.svg,http://www.punchbowl.com/holidays/2013/10/10/national-cake-decorating-day,Cake  from The Noun Project2013-10-11,National Coming Out Day,rainbow.svg,http://www.punchbowl.com/holidays/2013/10/11/national-coming-out-day,wikipedia2013-10-12,National Gumbo Day,soup.svg,http://www.punchbowl.com/holidays/2013/10/12/national-gumbo-day,Soup from The Noun Project2013-10-13,International Skeptics Day,question.svg,http://holidayinsights.com/moreholidays/October/internationalskepticsday.htm,Question designed by Henry Ryder from The Noun Project2013-10-14,National Dessert Day,cupcake.svg,http://holidayinsights.com/moreholidays/October/nationaldessertday.htm,Cupcake designed by Polina Flegontovna from The Noun Project2013-10-15,National Chicken Cacciatore Day,chicken.svg,http://www.punchbowl.com/holidays/2013/10/15/national-chicken-cacciatore-day,Chicken from The Noun Project2013-10-16,Dictionary Day,dictionary.svg,http://holidayinsights.com/moreholidays/October/dictionaryday.htm,Book designed by Sotirios Papavasilopoulos from The Noun Project2013-10-17,Wear Something Gaudy Day,shirt.svg,http://holidayinsights.com/moreholidays/October/gaudyday.htm,Shirt designed by Maurizio Fusillo from The Noun Project2013-10-18,No Beard Day,beard.svg,http://holidayinsights.com/moreholidays/October/nobeardday.htm,Beard from The Noun Project2013-10-19,Sweetest Day,candy.svg,http://www.punchbowl.com/holidays/2013/10/19/sweetest-day,Candy from The Noun Project2013-10-20,National Brandied Fruit Day,fruit.svg,http://holidayinsights.com/moreholidays/October/brandiedfruitday.htm,Fruit designed by Jayme Davis from The Noun Project2013-10-21,National Pumpkin Cheesecake Day,cake.svg,http://www.punchbowl.com/holidays/2013/10/21/national-pumpkin-cheesecake-day,Cake  from The Noun Project2013-10-22,National Nut Day,peanuts.svg,http://holidayinsights.com/moreholidays/October/nationalnutday.htm,Peanuts from The Noun Project2013-10-23,National Boston Cream Pie Day,pie.svg,http://www.punchbowl.com/holidays/2013/10/23/national-boston-cream-pie-day,Pie designed by Connie Shu from The Noun Project2013-10-24,National Bologna Day,bologna.svg,http://www.punchbowl.com/holidays/2013/10/24/national-bologna-day,Meat from The Noun Project2013-10-25,World Pasta Day,pasta.svg,http://www.pasta-unafpa.org/pasta-day.htm,Bow Tie Pasta designed by Gianluca Arena from The Noun Project2013-10-26,Make A Difference Day,volunteer.svg,http://www.punchbowl.com/holidays/2013/10/26/make-a-difference-day,Volunteer designed by Dima Yagnyuk from The Noun Project2013-10-27,American Beer Day,beer.svg,http://www.punchbowl.com/holidays/2013/10/27/american-beer-day,Beer designed by Benoit Champy from The Noun Project2013-10-28,Plush Animal Lover's Day,teddy.svg,http://holidayinsights.com/moreholidays/October/animalloversday.htm,Teddy Bear from The Noun Project2013-10-29,National Cat Day,cat.svg,http://www.punchbowl.com/holidays/2013/10/29/national-cat-day,Cat designed by Marie Coons from The Noun Project2013-10-30,National Candy Corn Day,candycorn.svg,http://holidayinsights.com/moreholidays/October/candycornday.htm,http://www.clker.com/2013-10-31,Carve A Pumpkin Day,pumpkin.svg,http://holidayinsights.com/moreholidays/October/carveapumpkinday.htm,Pumpkin designed by Adam  Mullin from The Noun Project2013-11-01,Day of The Dead,skull.svg,https://en.wikipedia.org/wiki/Day_of_the_Dead,Skull designed by Simon Child from The Noun Project2013-11-02,National Deviled Eggs Day,egg1.svg,http://www.punchbowl.com/holidays/2013/11/2/national-deviled-egg-day,Egg designed by John O&#39;Shea from The Noun Project2013-11-03,National Sandwich Day,sandwich.svg,http://holidayinsights.com/moreholidays/November/sandwichday.htm,Sandwich designed by Yara Soliman from The Noun Project2013-11-04,National Candy Day,candy.svg,http://www.punchbowl.com/holidays/2013/11/4/national-candy-day,Candy from The Noun Project2013-11-05,Guy Fawkes Day,fawkes.svg,http://holidayinsights.com/moreholidays/November/guyfawkesday.htm,Guy Fawkes designed by Juan Pablo Garc’a Sossa from The Noun Project2013-11-06,Saxophone Day,sax.svg,http://holidayinsights.com/moreholidays/November/saxophoneday.htm,2013-11-07,International Tongue Twister Day,tongue.svg,http://www.punchbowl.com/holidays/2013/11/7/international-tongue-twister-day,Tongue Out designed by Paul F. from The Noun Project2013-11-08,National Cappuccino Day,coffee.svg,http://www.punchbowl.com/holidays/2013/11/8/national-cappuccino-day,Coffee designed by Christopher Smith from The Noun Project2013-11-09,Sadie Hawkins Dat,dance.svg,http://www.punchbowl.com/holidays/2013/11/9/sadie-hawkins-day,Dance from The Noun Project2013-11-10,Forget-Me-Not Day,flower.svg,http://holidayinsights.com/moreholidays/November/forgetmenotday.htm,Flower  from The Noun Project2013-11-11,National Sundae Day,sundae.svg,http://www.punchbowl.com/holidays/2013/11/11/national-sundae-day,Ice Cream designed by Sam Marshall from The Noun Project2013-11-12,National Pizza With Everything On It Day,pizza.svg,http://www.punchbowl.com/holidays/2013/11/12/national-pizza-with-everything-except-anchovies-day,Pizza designed by Marcus Michaels from The Noun Project2013-11-13,World Kindness Day,love.svg,http://holidayinsights.com/moreholidays/November/worldkindnessday.htm,Love designed by Javier Cabezas from The Noun Project2013-11-14,National Pickle Day,jar.svg,http://www.punchbowl.com/holidays/2013/11/14/national-pickle-day,Jar designed by Connor Cesa from The Noun Project2013-11-15,America Recycles Day,recycle.svg,http://holidayinsights.com/moreholidays/November/americarecyclesday.htm,Recycle from The Noun Project2013-11-16,Button Day,button.svg,http://holidayinsights.com/moreholidays/November/buttonday.htm,Button designed by Christopher T. Howlett from The Noun Project2013-11-17,Homemade Bread Day,bread.svg,http://www.punchbowl.com/holidays/2013/11/17/homemade-bread-day,Bread designed by Diego Naive from The Noun Project2013-11-18,Occult Day,mystery.svg,http://holidayinsights.com/moreholidays/November/occultday.htm,Detective designed by Simon Child from The Noun Project2013-11-19,International Men's Day,men.svg,http://www.internationalmensday.com/,Man designed by Tamiko Young from The Noun Project2013-11-20,Beautiful Day,flower2.svg,http://holidayinsights.com/moreholidays/November/beautifulday.htm,Flower designed by Adam Zubin from The Noun Project2013-11-21,World Television Day,tv.svg,http://www.punchbowl.com/holidays/2013/11/21/world-television-day,Television  from The Noun Project2013-11-22,Go For a Ride Day,car.svg,http://holidayinsights.com/moreholidays/November/goforarideday.htm,Car designed by Andrew Cameron from The Noun Project2013-11-23,Eat a Cranberry Day,cranberry.svg,http://holidayinsights.com/moreholidays/November/eatacranberryday.htm,Mistletoe designed by Andrew McKinley from The Noun Project2013-11-24,Celebrate Your Unique Talent,juggle.svg,http://www.punchbowl.com/holidays/2013/11/24/celebrate-your-unique-talent-day,2013-11-25,National Parfait Day,froyo.svg,http://holidayinsights.com/moreholidays/November/parfaitday.htm,Frozen Yogurt designed by Bart Laugs from The Noun Project2013-11-26,National Cake Day,cake.svg,http://www.punchbowl.com/holidays/2013/11/26/national-cake-day,Cake  from The Noun Project2013-11-27,National Bavarian Cream Pie Day,pie.svg,http://www.punchbowl.com/holidays/2013/11/27/national-bavarian-cream-pie-day,Pie designed by Connie Shu from The Noun Project2013-11-28,National French Toast Day,toast.svg,http://www.punchbowl.com/holidays/2013/11/28/national-french-toast-day,Toast designed by Jacob Halton from The Noun Project2013-11-29,Square Dance Day,dancer.svg,http://holidayinsights.com/other/squaredanceday.htm,Dancer designed by Michael Rowe from The Noun Project2013-11-30,National Mousse Day,mousse.svg,http://www.punchbowl.com/holidays/2013/11/30/national-mousse-day,Pudding from The Noun Project2013-12-01,Eat A Red Apple Day,apple.svg,http://holidayinsights.com/moreholidays/December/eataredappleday.htm,Apple designed by James Pellizzi from The Noun Project2013-12-02,Mutt's Day,dog.svg,http://www.punchbowl.com/holidays/2013/12/2/mutts-day,Dog from The Noun Project2013-12-03,National Roof Over Your Head Day,shelter.svg,http://www.punchbowl.com/holidays/2013/12/3/national-roof-over-your-head-day,Shelter from The Noun Project2013-12-04,National Cookie Day,cookie.svg,http://www.punchbowl.com/holidays/2013/12/4/national-cookie-day,Cookie designed by Elves Sousa from The Noun Project