eventdate,title,image,link,credit2013-12-05,International Volunteer Day,volunteer.svg,http://www.un.org/en/events/volunteerday/,Volunteer designed by Dima Yagnyuk from The Noun Project2013-12-06,Mitten Tree Day,mittens.svg,http://holidayinsights.com/moreholidays/December/mittentreeday.htm,Mittens designed by Darrin Higgins from The Noun Project2013-12-07,Letter Writing Day,letter.svg,http://holidayinsights.com/moreholidays/December/letterwritingday.htm,Letter designed by Evgeniy Kozachenko from The Noun Project2013-12-08,National Brownie Day,cake.svg,http://www.punchbowl.com/holidays/2013/12/8/national-brownie-day,Cake  from The Noun Project2013-12-09,National Pastry Day,croissant.svg,http://www.punchbowl.com/holidays/2013/12/9/national-pastry-day,Croissant designed by Nicolas Molès from The Noun Project2013-12-10,National Lager Day,beer.svg,http://www.punchbowl.com/holidays/2013/12/10/national-lager-day,Beer designed by Benoit Champy from The Noun Project2013-12-11,International Mountain Day,mountain.svg,http://www.fao.org/forestry/internationalmountainday/en/,Mountain designed by Benjamin Orlovski from The Noun Project2013-12-12,National Poinsettia Day,poins.svg,http://holidayinsights.com/other/poinsettia.htm,Flower designed by Mike Wirth from The Noun Project2013-12-13,National Cocoa Day,cocoa.svg,http://www.punchbowl.com/holidays/2013/12/13/national-cocoa-day,Coffee Bean designed by Stephen Matthews from The Noun Project2013-12-14,Monkey Day,monkey.svg,http://www.monkeyday.com/,Monkey designed by Simon Child from The Noun Project2013-12-15,National Cupcake Day,cupcake.svg,http://www.punchbowl.com/holidays/2013/12/15/national-cupcake-day,Cupcake designed by Polina Flegontovna from The Noun Project2013-12-16,National Chocolate Covered Anything Day,chocolate.svg,http://holidayinsights.com/moreholidays/December/chocolatecovered.htm,Chocolate designed by Yo Szczepanska from The Noun Project2013-12-17,National Maple Syrup Day,pancakes.svg,http://www.punchbowl.com/holidays/2013/12/17/national-maple-syrup-day,Pancake designed by Jacob Halton from The Noun Project2013-12-18,Bake Cookies Day,cookie.svg,http://holidayinsights.com/other/bakecookiesday.htm,Cookie designed by Elves Sousa from The Noun Project2013-12-19,Look For An Evergreen Day,etree.svg,http://holidayinsights.com/moreholidays/December/evergreenday.htm,Tree designed by Shirley Wu from The Noun Project2013-12-20,Go Caroling Day,choir.svg,http://holidayinsights.com/moreholidays/December/gocarolingday.htm,Chorus designed by Bruno G_tjens Gonz‡lez from The Noun Project2013-12-21,National Flashlight Day,flashlight.svg,http://holidayinsights.com/moreholidays/December/flashlightday.htm,Flashlight designed by Simon Child from The Noun Project2013-12-22,National Date Nut Bread Day,breads.svg,http://www.punchbowl.com/holidays/2013/12/22/national-date-nut-bread-day,Bread designed by Michael Chiarella from The Noun Project2013-12-23,Festivus,festivus.svg,http://holidayinsights.com/moreholidays/December/festivus.htm,Christmas Lights designed by Megan Sheehan from The Noun Project2013-12-24,National Egg Nog Day,carton.svg,http://www.punchbowl.com/holidays/2013/12/24/national-egg-nog-day,Milk designed by Erin Agnoli from The Noun Project2013-12-25,National Pumpkin Pie Day,pie.svg,http://holidayinsights.com/moreholidays/December/pumpkinpieday.htm,Pie designed by Connie Shu from The Noun Project2013-12-26,National Candy Cane Day,candycane.svg,http://www.gone-ta-pott.com/national_candy_cane_day.html,Candy Cane designed by Simon Child from The Noun Project2013-12-27,National Fruitcake Day,pudding.svg,http://www.punchbowl.com/holidays/2013/12/27/national-fruit-cake-day,Pudding from The Noun Project2013-12-28,Card Playing Day,cards1.svg,http://holidayinsights.com/moreholidays/December/cardplayingday.htm,Playing Cards designed by Benjamin Orlovski from The Noun Project2013-12-29,Pepper Pot Day,soup.svg,http://www.punchbowl.com/holidays/2013/12/29/national-pepper-pot-day,Soup from The Noun Project2013-12-30,National Bicarbonate of Soda Day,armhammer.svg,http://holidayinsights.com/moreholidays/December/bicarbonateofsodaday.htm,wikipedia2013-12-31,National Champagne Day,champagne.svg,http://www.food.com/food-holidays/champagne-day-1231,Champagne designed by Eric Mueller from The Noun Project