eventdate,title,image,link,credit2013-01-01,New Year's Day,partyhat.svg,http://www.holidayinsights.com/other/newyears.htm,Party Hat designed by Minna Ninova from The Noun Project2013-01-02,National Buffet Day,buffet.svg,http://www.cdkitchen.com/recipes/articles/view/405/1/National-Buffet-Day.html,Buffet designed by Anand A Nair from The Noun Project2013-01-03,Fruitcake Toss Day,fruit.svg,http://www.punchbowl.com/holidays/2013/1/3/fruitcake-toss-day,Fruit designed by Jayme Davis from The Noun Project2013-01-04,Trivia Day,trivia.svg,http://www.holidayinsights.com/other/trivia.htm,Question designed by Martin Delin from The Noun Project2013-01-05,National Bird Day,bird.svg,http://www.nationalbirdday.com/,Bird designed by Javier Triana from The Noun Project2013-01-06,Bean Day,beans.svg,http://www.huffingtonpost.com/2011/01/06/national-bean-day-why-its_n_805328.html,Beans designed by Doug Cavendish from The Noun Project2013-01-07,Old Rock Day,rock.svg,http://www.altiusdirectory.com/Society/old-rock-day.php,Rock designed by Anuar Zhumaev from The Noun Project2013-01-08,Bubble Bath Day,bubblebath.svg,http://www.punchbowl.com/holidays/bubble-bath-day,Bubble Bath designed by Julia Soderberg from The Noun Project2013-01-09,National Apricot Day,apricot.svg,http://www.punchbowl.com/holidays/2013/1/9/national-apricot-day,Fruit designed by Evan Caughey from The Noun Project2013-01-10,Houseplant Appreciation Day,houseplant.svg,http://www.gardenersnet.com/fun/houseplantappreciation.htm,Plant designed by Aaron P. Brown from The Noun Project2013-01-11,Milk Day,milk.svg,http://familycrafts.about.com/od/holidays/p/MilkDay.htm,Milk  from The Noun Project2013-01-11,National Hot Toddy Day,cocktail.svg,http://www.punchbowl.com/holidays/2013/1/11/national-hot-toddy-day,Cocktail designed by Peacock Dream from The Noun Project2013-01-12,National Curried Chicken Day,chicken.svg,http://www.punchbowl.com/holidays/2013/1/12/curried-chicken-day,Chicken designed by carly vanderlee from The Noun Project2013-01-13,National Rubber Ducky Day,rubberduck.svg,http://www.punchbowl.com/holidays/2013/1/13/national-rubber-ducky-day,Rubber Duck designed by Simon Child from The Noun Project2013-01-14,National Dress Up Your Pet Day,dog.svg,http://holidayinsights.com/other/dresspet.htm,Dog from The Noun Project2013-01-15,National Hat Day,hat2.svg,http://holidayinsights.com/other/hatday.htm,Hat designed by pixeline from The Noun Project2013-01-16,Appreciate a Dragon Day,dragon.svg,http://www.donitakpaul.com/fun/aadd/,Dragon designed by Angela Dinh from The Noun Project2013-01-17,Kid Inventors' Day,idea.svg,http://www.kidinventorsday.com/,Idea designed by Cyrille LE FLOCH from The Noun Project2013-01-18,Thesaurus Day,book.svg,http://holidayinsights.com/other/thesaurusday.htm,Book designed by Nathan Thomson from The Noun Project2013-01-19,National Popcorn Day,popcorn.svg,http://www.punchbowl.com/holidays/2013/1/19/national-popcorn-day,Popcorn designed by andrei antonescu from The Noun Project2013-01-20,Penguin Awareness Day,penguin.svg,http://holidayinsights.com/other/penguinawareness.htm,Penguin designed by Camila Bertoco from The Noun Project2013-01-21,National Hugging Day,hug.svg,http://www.punchbowl.com/holidays/2013/1/21/national-hugging-day,Hug designed by Veysel Kara from The Noun Project2013-01-22,National Answer Your Cat's Questions Say,cat.svg,http://www.punchbowl.com/holidays/2013/1/22/national-answer-your-cats-questions-day,Cat designed by Marie Coons from The Noun Project2013-01-23,National Handwriting Day,handwriting.svg,http://holidayinsights.com/moreholidays/January/handwritingday.htm,Drawing designed by Daniel Shannon from The Noun Project2013-01-24,Compliment Day,smile.svg,http://holidayinsights.com/moreholidays/January/complimentday.htm,Smile from The Noun Project2013-01-25,Opposite Day,yingyang.svg,http://holidayinsights.com/moreholidays/January/oppositeday.htm,Ying Yang designed by Unknown from The Noun Project2013-01-26,National Peanut Brittle Day,peanut.svg,http://www.punchbowl.com/holidays/2013/1/26/national-peanut-brittle-day,Peanut Butter designed by Dustin Zimmerman from The Noun Project2013-01-27,Thomas Crapper Day,toilet.svg,http://www.punchbowl.com/holidays/2013/1/27/thomas-crapper-day,Toilet from The Noun Project2013-01-28,Bubble Wrap Appreciation Day,bubbles.svg,http://www.punchbowl.com/holidays/2013/1/28/bubble-wrap-appreciation-day,Bubbles designed by Wayne Tyler Sall from The Noun Project2013-01-29,National Puzzle Day,puzzle.svg,http://holidayinsights.com/moreholidays/January/puzzleday.htm,Puzzle designed by Dmitry Baranovskiy from The Noun Project2013-01-30,National Croissant Day,croissant.svg,http://www.punchbowl.com/holidays/2013/1/30/national-croissant-day,Croissant designed by Nicolas Molès from The Noun Project2013-01-31,Backward Day,backward.svg,http://holidayinsights.com/moreholidays/January/backwardday.htm,Skip Backward designed by John Chapman from The Noun Project2013-02-01,National Wear Red Day,red.svg,http://goredforwomen.org/wearredday/,Wikipedia2013-02-02,Ground Hog Day,snow.svg,http://www.punchbowl.com/holidays/2013/2/2/groundhog-day,Snow  from The Noun Project2013-02-03,National Carrot Cake Day,cake.svg,http://www.punchbowl.com/holidays/2013/2/3/national-carrot-cake-day,Cake  from The Noun Project2013-02-04,Thank a Mailman Day,mail.svg,http://holidayinsights.com/moreholidays/February/thankmailmanday.htm,Mail designed by Anand A Nair from The Noun Project2013-02-05,National Chocolate Fondue Day,chocolate.svg,http://www.punchbowl.com/holidays/2013/2/5/national-chocolate-fondue-day,Chocolate designed by Yo Szczepanska from The Noun Project2013-02-06,National Frozen Yogurt Day,froyo.svg,http://www.gone-ta-pott.com/national_frozen_yogurt_day.html,Frozen Yogurt designed by Bart Laugs from The Noun Project2013-02-07,Send a Card to a Friend Day,card.svg,http://holidayinsights.com/moreholidays/February/sendacardday.htm,Card designed by Amelia Wattenberger from The Noun Project2013-02-08,National Kite Flying Day,kite.svg,http://holidayinsights.com/moreholidays/February/kiteflyingday.htm,Kite from The Noun Project2013-02-09,National Bagels and Lox Day,salmon.svg,http://www.punchbowl.com/holidays/2013/2/9/national-bagels-lox-day,Salmon from The Noun Project2013-02-10,Umbrella Day,umbrella.svg,http://holidayinsights.com/moreholidays/February/umbrelladay.htm,Umbrella from The Noun Project2013-02-11,White T-Shirt Day,tshirt.svg,http://holidayinsights.com/moreholidays/February/makeafriendday.htm,Tshirt designed by Pasquale Ottaiano from The Noun Project2013-02-12,National Plum Pudding Day,pudding.svg,http://www.punchbowl.com/holidays/2013/2/12/national-plum-pudding-day,Pudding from The Noun Project2013-02-13,National Tortellini Day,pasta.svg,http://www.punchbowl.com/holidays/2013/2/13/national-tortellini-day,Bow Tie Pasta designed by Andrew Fortnum from The Noun Project2013-02-14,Ferris Wheel Day,ferris.svg,http://holidayinsights.com/moreholidays/February/ferriswheelday.htm,Ferris Wheel designed by doodletillidie from The Noun Project2013-02-15,Singles Awareness Day,person.svg,http://holidayinsights.com/other/singlesawareness.htm,Person designed by Tara from The Noun Project2013-02-16,National Almond Day,almond.svg,http://www.punchbowl.com/holidays/2013/2/16/national-almond-day,Almond designed by Peter Chlebak from The Noun Project2013-02-17,Random Acts of Kindness Day,smile.svg,http://holidayinsights.com/moreholidays/February/randomactskindness.htm,Smile from The Noun Project2013-02-18,Drink Wine Day,wine.svg,http://www.punchbowl.com/holidays/2013/2/18/drink-wine-day,Wine designed by Paul Philippe Berthelon Bravo from The Noun Project2013-02-19,National Chocolate Mint Day,chocolate.svg,http://holidayinsights.com/moreholidays/February/chocolatemintday.htm,Chocolate designed by Yo Szczepanska from The Noun Project2013-02-20,Love Your Pet Day,dog.svg,http://www.punchbowl.com/holidays/2013/2/20/love-your-pet-day,Dog from The Noun Project2013-02-21,Card Reading Day,cards.svg,http://holidayinsights.com/moreholidays/February/cardreadingday.htm,Playing Cards designed by Marcela Abbade from The Noun Project2013-02-22,National Margarita Day,margarita.svg,http://www.punchbowl.com/holidays/2013/2/22/national-margarita-day,Margarita designed by Adam Lorber from The Noun Project2013-02-23,Tennis Day,racket.svg,http://holidayinsights.com/moreholidays/February/tennisday.htm,Tennis racket designed by Gabriele Fumero from The Noun Project2013-02-24,National Tortilla Chip Day,taco.svg,http://www.punchbowl.com/holidays/2013/2/24/national-tortilla-chip-day,Taco designed by Pei Wen (Winnie) Kwang from The Noun Project2013-02-25,National Chocolate Covered Nuts Day,hazelnut.svg,http://www.punchbowl.com/holidays/2013/2/25/national-chocolate-covered-nuts-day,Hazelnuts designed by Kate Vogel from The Noun Project2013-02-26,Carnival Day,circus.svg,http://holidayinsights.com/moreholidays/February/carnivalday.htm,Circus Tent designed by Jeff Ahlberg from The Noun Project2013-02-27,Polar Bear Day,bear.svg,http://www.polarbearsinternational.org/our-work/action-programs/international-polar-bear-day,Bear designed by Cyrille LE FLOCH from The Noun Project2013-02-28,National Tooth Fairy Day,tooth.svg,http://www.punchbowl.com/holidays/2013/2/28/national-tooth-fairy-day,Tooth from The Noun Project2013-03-01,National Peanut Butter Lover's Day,peanut.svg,http://www.punchbowl.com/holidays/2013/3/1/national-peanut-butter-lovers-day,Peanut Butter designed by Dustin Zimmerman from The Noun Project2013-03-02,Old Stuff Day,oldphone.svg,http://holidayinsights.com/moreholidays/March/oldstuffday.htm,Telephone designed by Scott Lewis from The Noun Project2013-03-03,If Pets Had Thumbs Day,thumbsup.svg,http://holidayinsights.com/moreholidays/March/petthumbsday.htm,Thumbs Up designed by Nick Holroyd from The Noun Project2013-03-04,Learn What Your Name Means Day,inspector.svg,http://www.punchbowl.com/holidays/2013/3/4/learn-what-your-name-means-day,Inspector designed by lilian midori fukuhara from The Noun Project2013-03-05,National Cheese Doodle Day,cheese.svg,http://www.punchbowl.com/holidays/2013/3/5/national-cheese-doodle-day,Cheese  from The Noun Project2013-03-06,Dentist's Day,toothbrush.svg,http://holidayinsights.com/moreholidays/March/dentistsday.htm,Toothbrush designed by Joanna Smolonska from The Noun Project2013-03-07,National Cereal Day,cereal.svg,http://www.punchbowl.com/holidays/2013/3/7/national-cereal-day,Cereal designed by Jacob Halton from The Noun Project2013-03-08,Be Nasty Day,evil.svg,http://holidayinsights.com/moreholidays/March/benastyday.htm,Bad Apple designed by john ryan sonderegger from The Noun Project2013-03-09,Panic Day,panic.svg,http://holidayinsights.com/moreholidays/March/panicday.htm,Panic from The Noun Project2013-03-10,International Day of Awesomeness,thumbsup.svg,http://dayofawesomeness.com/,Thumbs Up designed by Nick Holroyd from The Noun Project2013-03-11,Johnny Appleseed Day,apple.svg,http://holidayinsights.com/moreholidays/March/appleseedday.htm,Apple designed by Jon Testa from The Noun Project2013-03-12,Plant a Flower Day,flower.svg,http://holidayinsights.com/moreholidays/March/plantflowerday.htm,Flower  from The Noun Project2013-03-13,Ear Muffs Day,earmuffs.svg,http://www.punchbowl.com/holidays/2013/3/13/ear-muffs-day,Earmuffs from The Noun Project2013-03-14,National Pi Day,circle.svg,http://holidayinsights.com/moreholidays/March/piday.htm,Circle designed by Thomas Le Bas from The Noun Project2013-03-15,Incredible Kid Day,child.svg,http://holidayinsights.com/moreholidays/March/incrediblekidday.htm,Child designed by Javier Cabezas from The Noun Project2013-03-16,Everything You Do Is Right Day,checkmark.svg,http://holidayinsights.com/moreholidays/March/everythingrightday.htm,Check Mark designed by Anas Ramadan from The Noun Project2013-03-17,Saint Patrick's Day,clover.svg,http://www.punchbowl.com/holidays/2013/3/17/st-patricks-day,Clover designed by Pavel Nikandrov from The Noun Project2013-03-18,Oatmeal Cookie Day,cookie.svg,http://www.punchbowl.com/holidays/2013/3/18/oatmeal-cookie-day,Cookie designed by Elves Sousa from The Noun Project2013-03-19,National Agriculture Day,tree.svg,http://www.agday.org/,Tree designed by Francesco Terzini from The Noun Project2013-03-20,World Storytelling Day,story.svg,http://www.freewebs.com/worldstorytellingday/,Book designed by Tiago Franco from The Noun Project2013-03-21,Fragrance Day,perfume.svg,http://holidayinsights.com/moreholidays/March/fragranceday.htm,Perfume designed by Anna Sher from The Noun Project2013-03-22,World Water Day,waterdrop.svg,http://www.unwater.org/water-cooperation-2013/home/en/,Wikipedia2013-03-23,National Puppy Day,dog.svg,http://www.punchbowl.com/holidays/2013/3/23/national-puppy-day,Dog from The Noun Project2013-03-24,National Chocolate Covered Raisin Day,jellybeans.svg,http://holidayinsights.com/moreholidays/March/chocolateraisinday.htm,Jellybeans from The Noun Project2013-03-25,Old New Year's Day,champagne.svg,http://www.punchbowl.com/holidays/2013/3/25/old-new-years-day,Champagne from The Noun Project2013-03-26,Make Up Your Own Holiday Day,partyhat.svg,http://www.punchbowl.com/holidays/2013/3/26/make-up-your-own-holiday-day,Party Hat designed by Minna Ninova from The Noun Project2013-03-27,Quirky Country Music Song Titles Day,cowboyboot.svg,http://www.punchbowl.com/holidays/2013/3/27/quirky-country-music-song-titles-day,Cowboy Boot designed by Roy Milton from The Noun Project2013-03-28,Eggsibit Day,easteregg.svg,http://www.punchbowl.com/holidays/2013/3/28/eggsibit-day,Easter Egg designed by irene hoffman from The Noun Project2013-03-29,National Mom and Pop Business Owners Day,mompop.svg,http://holidayinsights.com/moreholidays/March/mpboday.htm,Business from The Noun Project2013-03-30,National Doctor's Day,doctor.svg,http://www.holidayinsights.com/moreholidays/March/doctorsday.htm,The Noun Project2013-03-31,Bunsen Burner Day,bunsen.svg,http://www.wisegeek.com/what-is-bunsen-burner-day.htm,The Noun Project2013-04-01,April Fool's Day,clown.svg,http://en.wikipedia.org/wiki/April_Fools'_Day,Clown designed by B Barrett from The Noun Project2013-04-02,Children's Book Day,book.svg,http://www.ibby.org/index.php?id=269,Book designed by Nathan Thomson from The Noun Project2013-04-03,Tweed Day,tweed.svg,http://www.altiusdirectory.com/Society/national-tweed-day.html,Suit designed by jon trillana from The Noun Project2013-04-04,National Cordon Bleu Day,chicken.svg,http://www.punchbowl.com/holidays/2013/4/4/national-cordon-bleu-day,The Noun Project2013-04-05,National Caramel Day,candy.svg,http://www.punchbowl.com/holidays/2013/4/5/national-caramel-day,The Noun Project2013-04-06,National Tartan Day,tartan.svg,http://www.punchbowl.com/holidays/2013/4/6/national-tartan-day,Tartan designed by Carol A. L. Martin from The Noun Project2013-04-07,World Health Day,who.svg,http://www.who.int/world-health-day/,World Health Organization2013-04-08,National Empanada Day,croissant.svg,http://www.punchbowl.com/holidays/2013/4/8/national-empanada-day,Croissant designed by Nicolas Molès from The Noun Project2013-04-09,National Cherish an Antique Day,oldphone.svg,http://www.punchbowl.com/holidays/2013/4/9/national-cherish-an-antique-day,Telephone designed by Scott Lewis from The Noun Project2013-04-10,National Siblings Day,people.svg,http://www.siblingsday.org/,People designed by Roman J. Sokolov from The Noun Project2013-04-11,National Submarine Day,submarine.svg,http://en.wikipedia.org/wiki/Submarine_Day,Submarine designed by Paulo S‡ Ferreira from The Noun Project2013-04-12,National Grilled Cheese Day,sandwich.svg,http://www.punchbowl.com/holidays/2013/4/12/national-grilled-cheese-day,"Sandwich designed by Tom Glass, Jr. from The Noun Project"2013-04-13,Scrabble Day,checkers.svg,http://wiki.answers.com/Q/How_do_you_celebrate_National_Scrabble_Day,Checkerboard designed by Benjamin Orlovski from The Noun Project2013-04-14,International Moment of Laughter Day,laugh.svg,http://www.punchbowl.com/holidays/2013/4/14/international-moment-of-laughter-day,2013-04-15,Tax Day,calculator.svg,http://www.punchbowl.com/holidays/2013/4/15/tax-day,The Noun Project2013-04-16,National Eggs Benedict Day,egg.svg,http://www.punchbowl.com/holidays/2013/4/16/national-eggs-benedict-day,Egg designed by Johan H. W. Basberg from The Noun Project2013-04-17,National Cheeseball Day,cheese.svg,http://holidayinsights.com/moreholidays/April/cheeseballday.htm,Cheese  from The Noun Project2013-04-18,National High Five Day,hand.svg,https://www.facebook.com/nationalhighfiveday,Hand designed by Ugur Akdemir from The Noun Project2013-04-19,National DNA Day,dna.svg,http://www.genome.gov/DNADay/,DNA designed by Darrin Higgins from The Noun Project2013-04-20,Look Alike Day,people2.svg,http://www.holidayinsights.com/moreholidays/April/lookalikeday.htm,People designed by richard pasqua from The Noun Project2013-04-21,World Creativity and Innovation Day,idea.svg,http://worldcreativity.wordpress.com/about/,Idea designed by Cyrille LE FLOCH from The Noun Project2013-04-22,Earth Day,earth.svg,http://www.earthday.org/,Earth designed by Francesco Paleari from The Noun Project2013-04-23,World Laboratory Day,beaker.svg,http://holidayinsights.com/moreholidays/April/worldlaboratoryday.htm,Beaker designed by Sergey Shmidt from The Noun Project2013-04-24,Pigs in a Blanket Day,hotdog.svg,http://en.wikipedia.org/wiki/Pigs_in_blankets#United_States,Hot Dog designed by Trevor Tarczynski from The Noun Project2013-04-25,World Penguin Day,penguin.svg,http://worldpenguinday.com/,Penguin designed by Camila Bertoco from The Noun Project2013-04-26,National Pretzel Day,pretzel.svg,http://www.punchbowl.com/holidays/2013/4/26/national-pretzel-day,Pretzel  from The Noun Project2013-04-27,National Prime Rib Day,steak.svg,http://www.punchbowl.com/holidays/2013/4/27/national-prime-rib-day,Steak designed by Anuar Zhumaev from The Noun Project2013-04-28,Workers' Memorial Day,worker.svg,http://en.wikipedia.org/wiki/Workers_Memorial_Day,Worker designed by M‡rcio Duarte from The Noun Project2013-04-29,International Dance Day,ballet.svg,http://www.international-dance-day.org/en/danceday.html,Ballet Dancer designed by Joris Hoogendoorn from The Noun Project2013-04-30,International Jazz Day,sax.svg,http://jazzday.com/,The Noun Project2013-05-01,May Day,partyhat.svg,http://en.wikipedia.org/wiki/May_Day,Party Hat designed by Minna Ninova from The Noun Project2013-05-02,Brothers and Sisters Day,people.svg,http://holidayinsights.com/moreholidays/May/brothersisterday.htm,People designed by Roman J. Sokolov from The Noun Project2013-05-03,Space Day,spaceship.svg,http://www.spaceday.com/,The Noun Project2013-05-04,Star Wars Day,deathstar.svg,http://en.wikipedia.org/wiki/Star_Wars_Day,Death Star designed by Andrew Forrester from The Noun Project2013-05-05,Cinco de Mayo,maracas.svg,http://en.wikipedia.org/wiki/Cinco_de_Mayo,Maracas designed by Renaud Mignerey from The Noun Project2013-05-06,National Nurses Day,nurse.svg,http://www.calendar-updates.com/info/holidays/us/nurse.aspx,Nurse designed by Scott Lewis from The Noun Project2013-05-07,National Teacher Day,teacher.svg,http://www.nea.org/grants/1359.htm,The Noun Project2013-05-08,World Red Cross Day / World Red Crescent Day,redcross.gif,http://en.wikipedia.org/wiki/World_Red_Cross_and_Red_Crescent_Day,2013-05-09,Lost Sock Memorial Day,socks.svg,http://holidayinsights.com/other/lostsockday.htm,Sock designed by Proletkult Graphik from The Noun Project2013-05-10,National Shrimp Day,shrimp.svg,http://www.giftypedia.com/National_Shrimp_Day,Shrimp designed by Jeffrey Qua from The Noun Project2013-05-11,Twilight Zone Day,spiral.svg,http://www.holidayinsights.com/moreholidays/May/twilightzoneday.htm,The Noun Project2013-05-12,Limerick Day,clover.svg,http://www.holidayinsights.com/stpat/limerickday.htm,Clover designed by Pavel Nikandrov from The Noun Project2013-05-13,Frog Jumping Day,frog.svg,http://www.delconewsnetwork.com/articles/2012/05/13/entertainment/doc4fafb711aa00e917794010.txt,Frog designed by Christian Bonin from The Noun Project2013-05-14,Dance Like a Chicken Day,chicken1.svg,http://holidayinsights.com/moreholidays/May/dancelikeachicken.htm,Chicken designed by carly vanderlee from The Noun Project2013-05-15,National Chocolate Chip Day,chocolate.svg,http://holidayinsights.com/moreholidays/May/chocolatechipday.htm,Chocolate designed by Yo Szczepanska from The Noun Project2013-05-16,National Sea Monkey Day,monkey.svg,http://www.punchbowl.com/holidays/2013/5/16/national-sea-monkey-day,Monkey from The Noun Project2013-05-17,Pack Rat Day,boxes.svg,http://holidayinsights.com/moreholidays/May/packratday.htm,Boxes designed by  VALéRE DAYAN  from The Noun Project2013-05-18,International Museum Day,museum.svg,http://icom.museum/events/international-museum-day/,Museum designed by Joris Hoogendoorn from The Noun Project2013-05-19,National Devil's Food Cake Day,cake.svg,http://www.punchbowl.com/holidays/2013/5/19/national-devils-food-cake-day,Cake  from The Noun Project2013-05-20,Pick Strawberries Day,strawberry.svg,http://holidayinsights.com/moreholidays/May/pickstrawberriesday.htm,Strawberry designed by Viktor Hertz from The Noun Project2013-05-21,National Waiter's and Waitresses Day,waiter.svg,http://holidayinsights.com/moreholidays/May/waitersday.htm,Waiter designed by Scott Lewis from The Noun Project2013-05-22,National Vanilla Pudding Day,bowl.svg,http://www.punchbowl.com/holidays/2013/5/22/national-vanilla-pudding-day,Bowl designed by Anna Evans from The Noun Project2013-05-23,World Turtle Day,turtle.svg,http://en.wikipedia.org/wiki/World_Turtle_Day,Turtle designed by Unrecognized from The Noun Project2013-05-24,National Escargot Day,snail.svg,http://holidayinsights.com/moreholidays/May/escargotday.htm,Snail designed by aLf from The Noun Project2013-05-25,Geek Pride Day,geek.svg,http://en.wikipedia.org/wiki/Geek_Pride_Day,Pocket Protector designed by Drew Ellis from The Noun Project2013-05-26,National Blueberry Cheesecake Day,cake.svg,http://www.punchbowl.com/holidays/2013/5/26/national-blueberry-cheesecake-day,Cake  from The Noun Project2013-05-27,Sunscreen Day,sunscreen.svg,http://www.punchbowl.com/holidays/2013/5/27/sun-screen-day,Sunscreen designed by Olivier Guin from The Noun Project2013-05-28,National Hamburger Day,burger.svg,http://www.punchbowl.com/holidays/2013/5/28/national-hamburger-day,Hamburger designed by Pei Wen (Winnie) Kwang from The Noun Project2013-05-29,Learn About Composting Day,compost.svg,http://holidayinsights.com/moreholidays/May/compostingday.htm,Compost Bin designed by Gemma Garner from The Noun Project2013-05-30,Water a Flower Day,flower.svg,http://holidayinsights.com/moreholidays/May/waterflowerday.htm,Flower  from The Noun Project2013-05-31,National Macaroon Day,macaroon.svg,http://holidayinsights.com/moreholidays/May/macaroonday.htm,Macaroon designed by Amanda Widjaya from The Noun Project2013-06-01,World Milk Day,milk.svg,http://www.tetrapak.com/about_tetra_pak/press_room/news/Pages/CelebratingWorldMilkDay.aspx,Milk  from The Noun Project2013-06-02,National Rocky Road Day,icecream.svg,http://holidayinsights.com/moreholidays/June/rockyroadday.htm,Icecream from The Noun Project2013-06-03,National Egg Day,egg.svg,http://www.punchbowl.com/holidays/2013/6/3/national-egg-day,Egg designed by Johan H. W. Basberg from The Noun Project2013-06-04,National Hug Your Cat Day,cat.svg,http://holidayinsights.com/moreholidays/June/hugyourcatday.htm,Cat designed by Marie Coons from The Noun Project2013-06-05,World Environment Day,leaf.svg,http://www.unep.org/wed/,Leaf from The Noun Project2013-06-06,National Yo-Yo Day,yoyo.svg,http://www.punchbowl.com/holidays/2013/6/6/yo-yo-day,Yoyo from The Noun Project2013-06-07,National Donut Day,donut.svg,http://holidayinsights.com/moreholidays/June/chocolateicecream.htm,Doughnut designed by Jacob Halton from The Noun Project2013-06-08,Best Friends Day,friends.svg,http://www.punchbowl.com/holidays/2013/6/8/best-friends-day,Friends designed by Rob Schill from The Noun Project2013-06-09,Donald Duck Day,disney.svg,http://holidayinsights.com/moreholidays/June/donaldduckday.htm,Micky Mouse Ears designed by Miranda Dempster from The Noun Project2013-06-10,Iced Tea Day,icedtea.svg,http://www.punchbowl.com/holidays/2013/6/10/iced-tea-day,Drink designed by Anthony Lui from The Noun Project2013-06-11,Hug Holiday,hug.svg,http://holidayinsights.com/moreholidays/June/hugholiday.htm,Hug designed by Veysel Kara from The Noun Project2013-06-12,Red Rose Day,rose.svg,http://holidayinsights.com/moreholidays/June/redroseday.htm,Rose from The Noun Project2013-06-13,Sewing Machine Day,sewingmachine.svg,http://www.punchbowl.com/holidays/2013/6/13/sewing-machine-day,Sewing Machine from The Noun Project2013-06-14,Flag Day,flag.svg,http://en.wikipedia.org/wiki/Flag_Day_(United_States),Flag  from The Noun Project2013-06-15,Smile Power Day,smile.svg,http://holidayinsights.com/moreholidays/June/smilepowerday.htm,Smile from The Noun Project2013-06-16,National Fudge Day,chocolate.svg,http://www.punchbowl.com/holidays/2013/6/16/fudge-day,Chocolate designed by Yo Szczepanska from The Noun Project2013-06-17,Eat Your Vegetables Day,broccoli.svg,http://holidayinsights.com/other/eatyourvegetablesday.htm,Broccoli designed by John Chapman from The Noun Project2013-06-18,International Picnic Day,picnic.svg,http://www.punchbowl.com/holidays/2013/6/18/international-picnic-day,Basket designed by Patrick Morrison from The Noun Project2013-06-19,National Martini Day,martini.svg,http://www.punchbowl.com/holidays/2013/6/19/national-martini-day,Martini Glass designed by Shirley Wu from The Noun Project